{
  "version": "0.5.0",
  "owner": "agent-cluster-contracts",
  "description": "SSOT for agent roles. Each role declares allowed_paths (glob patterns) and forbidden_paths (glob patterns). agentguard verify reads the PR's changed-file list and the declared role, then rejects diffs that touch forbidden paths or contain only-not-allowed paths.\n\nA role's effective rule is: every changed file must match at least one allowed_paths glob, AND must not match any forbidden_paths glob. forbidden_paths win on conflict.\n\nIMPORTANT — path convention: globs are REPO-RELATIVE, not monorepo-relative. The dumb-agent-safety workflow runs inside the contracts repo and feeds agentguard the output of `git diff --name-only` (paths like `fixtures/positive/x.json`, not `contracts/fixtures/positive/x.json`). Decision 004 fixed an earlier monorepo-style miswrite that prevented every dumb-agent PR from passing. If a future role needs to gate paths in backend or frontend, add a separate workflow in that repo.\n\nSee contracts/AGENT_CONTRACT.md for the human-readable mirror.",
  "roles": [
    {
      "id": "designer",
      "label": "Designer / human-driven implementer",
      "description": "The primary author class. Can touch any file in any repo. Subject to manual review and other CI gates, not to the path allowlist.",
      "decision": "001-initial-agreement",
      "allowed_paths": ["**"],
      "forbidden_paths": [],
      "pr_isolation": {
        "candidate_only": false,
        "guard_only": false
      }
    },
    {
      "id": "dumb-agent",
      "label": "Contract Fuzzer Agent / IR Mutation Scout",
      "description": "Low-context closed-loop probe. Generates small candidates and lets verifiers decide. Never makes semantic decisions, never modifies accepted contracts, schemas, decisions, verifier code, or CI workflows. Allowed task types: positive fixture, negative fixture, fuzz corpus expansion, manifest normalization, failure minimization (output as a guard-candidate note since reports/min/ is no longer in scope).",
      "decision": "005-dumb-agent-probe-baseline-and-fixture-verifier",
      "allowed_paths": [
        "fixtures/positive/**",
        "fixtures/negative/**",
        "fuzz/corpus/**",
        "ir/candidates/**",
        "reports/guard-candidates/**",
        "reports/environment-blockers/**"
      ],
      "forbidden_paths": [
        "tools/**",
        ".github/workflows/**",
        "decisions/**",
        "dsl/**",
        "ir/schema/**",
        "ssot-dependency-map.riido.json",
        "concept-map/concept-map.riido.json",
        "agent-roles.riido.json"
      ],
      "pr_isolation": {
        "candidate_only": true,
        "guard_only": false,
        "rationale": "Forbidding the dumb agent from touching verifier code in the same PR prevents it from weakening tests to make its candidates pass."
      },
      "max_files_per_pr": 5,
      "auto_merge_eligible": true,
      "auto_merge_paths": [
        "fixtures/positive/**",
        "fixtures/negative/**",
        "fuzz/corpus/**",
        "reports/guard-candidates/**",
        "reports/environment-blockers/**"
      ],
      "merge_authority": {
        "granted": true,
        "decision": "010-dumb-agent-bounded-merge-authority",
        "rationale": "Bounded merge authority over candidate/evidence space only. agentguard merge-check enforces: every file in auto_merge_paths, none in forbidden_paths, file count <= max_files_per_pr. ir/candidates/ is intentionally writable but NOT auto-mergeable — designer reviews IR candidates."
      }
    },
    {
      "id": "guard-author",
      "label": "Verifier / schema / test author",
      "description": "Modifies verifier logic, schemas, or tests. May NOT touch candidate-space in the same PR. Subject to manual review of the verifier change.",
      "decision": "004-agentguard-diagnostics-and-role-realignment",
      "allowed_paths": [
        "tools/**",
        "internal/**",
        "decisions/schema.riido.json",
        "concept-map/schema.riido.json",
        "ir/schema/**",
        "go.mod",
        "go.sum",
        ".github/workflows/**",
        "**/*_test.go"
      ],
      "forbidden_paths": [
        "fixtures/**",
        "fuzz/**",
        "ir/candidates/**"
      ],
      "pr_isolation": {
        "candidate_only": false,
        "guard_only": true
      }
    }
  ]
}
